Shipment_Key,Destination,Delivery_Date,ShoppingCart_Key,Status
859,"Mrs. Bernadette Fleming, Camden  4472, San Bernardino - 2761, Botswana",11/23/2014,859,Dispatched
860,"Mr. Denis Nanton, Egerton  8357, Glendale - 5818, Belgium",3/10/2010,860,Shipped
861,"Ms. Lucy Yard, Blue Anchor  181, Atlanta - 4505, Iran",5/26/2000,861,Pending
862,"Mrs. Teagan Seymour, Westcott  7, Denver - 6746, Turkey",12/15/2009,862,In process
863,"Mr. Wade Blackwall, Castlereagh   489, Milwaukee - 0435, Seychelles",5/10/2004,863,Delivered
864,"Mr. Russel Jefferson, Babmaes    2459, Tallahassee - 8033, Colombia",2/28/2006,864,Dispatched
865,"Mr. Hank Stone , Blenkarne  8529, Kansas City - 1445, Uganda",5/3/2007,865,Shipped
866,"Ms. Tess Brown, Becklow  8954, Bridgeport - 0324, Korea, North",2/2/2014,866,Pending
867,"Mr. Denis Donnelly, St. Jamess  2649, Paris - 8823, Peru",3/22/2013,867,In process
868,"Mr. Domenic Walsh, Thomas More   6071, Sacramento - 2008, Monaco",9/21/2007,868,Delivered
869,"Mr. Chad Carter, Canon 272, San Francisco - 5164, New Zealand",1/12/2011,869,Dispatched
870,"Mrs. Claire Lucas, Coalecroft  8073, Washington - 6544, India",6/23/2006,870,Shipped
871,"Mrs. Rhea Russell, Calvin   4598, Cincinnati - 7477, Belize",5/2/2002,871,Pending
872,"Ms. Sonya Broomfield, Andrews  6746, Minneapolis - 8664, Burkina Faso",5/26/2011,872,In process
873,"Mr. George Cartwright, Apollo  8763, Venice - 2762, Luxembourg",3/18/2019,873,Delivered
874,"Ms. Havana Swan, Rosewood 7757, Columbus - 1217, Lesotho",3/8/2019,874,Dispatched
875,"Ms. Alessia Reid, Victoria  8942, Seattle - 6080, Uzbekistan",1/5/2009,875,Shipped
876,"Mr. Kieth Brooks, Falconberg   9613, Lakewood - 2835, Kosovo",1/7/2000,876,Pending
877,"Mr. William Cartwright, King Edward  431, Pittsburgh - 7862, Sri Lanka",2/22/2015,877,In process
878,"Miss Ciara Parker, Cloth  299, Long Beach - 5116, Korea, North",8/25/2005,878,Delivered
879,"Ms. Adalind Hill, Betton  682, Columbus - 8412, Azerbaijan",11/22/2014,879,Dispatched
880,"Mr. Lucas Lindsay, Lincoln 6117, Jacksonville - 3636, Canada",7/6/2006,880,Shipped
881,"Mr. Domenic Thomas, Dyott   3630, San Antonio - 1332, Estonia",10/14/2015,881,Pending
882,"Miss Mya Miller, Belgrave  6803, Salt Lake City - 0486, Iraq",4/9/2006,882,In process
883,"Ms. Zara Needham, Dunstans  1312, Indianapolis - 1226, Lithuania",1/6/2008,883,Delivered
884,"Mrs. Goldie Russell, Liverpool  3805, Glendale - 2638, Hungary",7/31/2013,884,Dispatched
885,"Ms. Alexa Burnley, Thomas Doyle   9944, Detroit - 3247, Egypt",3/9/2020,885,Shipped
886,"Mr. Julian Savage, Cheney  626, Madison - 2281, Palau",9/4/2003,886,Pending
887,"Miss Monica Walsh, Calderwood   9659, Otawa - 5512, Saint Vincent and the Grenadines",5/31/2010,887,In process
888,"Mrs. Francesca Robertson, Fairbairn  173, Richmond - 5583, Kiribati",4/25/2017,888,Delivered
889,"Ms. Cynthia Shaw, Mariner   3617, Philadelphia - 2411, Israel",11/1/2015,889,Dispatched
890,"Mr. Nate Baxter, Duthie   695, Las Vegas - 3555, Uzbekistan",2/26/2011,890,Shipped
891,"Miss Sharon Richards, Rivervalley 1241, Reno - 3410, Cameroon",3/26/2017,891,Pending
892,"Mr. Elijah Rees, Boadicea   4555, Paris - 7124, Oman",1/23/2015,892,In process
893,"Mr. Rick Jobson, Arlington  3598, Indianapolis - 5782, Colombia",5/24/2000,893,Delivered
894,"Ms. Ruby Fenton, Dunton  4938, Indianapolis - 4532, Sierra Leone",2/21/2012,894,Dispatched
895,"Mr. Wade Giles, Becher  8938, Kansas City - 7453, Russia",9/11/2003,895,Shipped
896,"Mr. Chad Chappell, Emden   1642, Tokyo - 8803, Malaysia",10/3/2002,896,Pending
897,"Miss Hannah Irving, Sheringham   806, Bakersfield - 7150, Qatar",6/12/2002,897,In process
898,"Mr. Henry Dowson, Coborn  2630, Oakland - 1325, Grenada",9/2/2010,898,Delivered
899,"Ms. Bridget Ainsworth, Birkin   2308, Prague - 5352, Malawi",4/9/2001,899,Dispatched
900,"Mr. Leroy Kennedy, Clifton  8813, Nashville - 0162, Nepal",12/20/2009,900,Shipped
901,"Mr. Jayden Gilmour, Chart   599, Scottsdale - 2546, China",1/10/2000,901,Pending
902,"Mr. Henry Stone, Balham   116, Arlington - 7600, Mongolia",6/25/2020,902,In process
903,"Mr. Barry Gallacher, Cecilia  7048, Fayetteville - 6180, Switzerland",9/17/2003,903,Delivered
904,"Miss Dani Healy, Yorkshire  5922, Milano - 7843, Ghana",11/14/2020,904,Dispatched
905,"Mr. John Overson, Ayres   3254, Orlando - 7535, Oman",5/6/2019,905,Shipped
906,"Mrs. Drew Noach, Cadogan  3639, Hollywood - 5037, Jamaica",4/16/2006,906,Pending
907,"Mrs. Skylar Welsch, Sheffield 6267, Denver - 2441, Mozambique",4/26/2020,907,In process
908,"Mrs. Mayleen Robertson, Ayres   2986, Fayetteville - 8563, India",12/11/2010,908,Delivered
909,"Mr. Michael Amstead, Bletchley   9852, Washington - 3344, Turkmenistan",3/7/2004,909,Dispatched
910,"Mr. Chad Whitmore, Carolina  2216, Murfreesboro - 3270, United Arab Emirates",1/7/2006,910,Shipped
911,"Mr. Hank Stevenson, Clissold  3672, New Orleans - 8121, Cambodia",2/28/2017,911,Pending
912,"Mr. Ryan Norton, Paris   7130, Irving - 3112, Kyrgyzstan",3/18/2019,912,Pending
913,"Mr. Gil Middleton, Abbey   3515, Ontario - 0345, Suriname",6/14/2001,913,Pending
914,"Miss Marigold Riley, Bellenden   1467, Phoenix - 2171, Israel",10/11/2002,914,Pending
915,"Mr. Tyler Harris, Blackall   4135, Madrid - 6441, Central African Republic",3/10/2003,915,Pending
916,"Mr. Nicholas Willson, Carlton  3653, Reno - 6361, Australia",10/8/2004,916,Pending
917,"Miss Cara Ralph, Ampton  8361, Orlando - 6212, Macedonia",7/3/2020,917,Pending
918,"Mr. Doug Edler, Bermondsey    7391, Paris - 7132, Central African Republic",12/12/2005,918,Pending
919,"Mr. Ryan Jarvis, Dunstable   1723, Huntsville - 6358, Slovenia",3/1/2001,919,Pending
920,"Mr. Abdul Welsch, Arundel   7165, Tulsa - 7538, Oman",2/20/2011,920,Pending
921,"Mrs. Scarlett Seymour, Empress  8178, Irving - 2617, Canada",8/26/2016,921,Pending
922,"Mr. Logan Cooper, Jackson 8202, Valetta - 7266, Namibia",2/19/2004,922,Pending
923,"Miss Ivy Walter, Enderby   5582, Amarillo - 6548, Pakistan",6/9/2018,923,Pending
924,"Mr. Bob Harrington, Collent   4274, Oakland - 8867, Australia",6/15/2001,924,Pending
925,"Mr. William Morrison, Sherlock   566, Springfield - 1473, Latvia",1/21/2018,925,Pending
926,"Mr. Wade Kennedy, Waite  1162, Seattle - 6166, Germany",1/12/2015,926,Pending
927,"Mr. Chadwick Nobbs, Cato   728, Los Angeles - 4035, Austria",7/21/2000,927,Pending
928,"Miss Erica Saunders, Norfolk  3189, Jacksonville - 7327, Ecuador",9/30/2006,928,Pending
929,"Mr. Chris Carson, Calderwood   7601, Lancaster - 5166, Czech Republic",12/16/2009,929,Pending
930,"Miss Ruby Tindall, Meadow 5190, Bellevue - 0247, Vietnam",11/20/2004,930,Pending
931,"Mr. Julian Antcliff, East 1886, Laredo - 0278, Sweden",2/24/2012,931,Pending
932,"Mr. Martin Gaynor, Caldwell   5870, New Orleans - 5435, Chile",7/3/2020,932,Pending
933,"Mr. Abdul Stanton, Balfour    3016, Milwaukee - 4634, Pakistan",6/2/2011,933,Pending
934,"Mr. Luke Roscoe, Commercial  7567, Washington - 3308, Moldova",9/7/2011,934,Pending
935,"Mr. Aiden Potter, Central  7853, Henderson - 2407, Italy",4/12/2001,935,Pending
936,"Mrs. Deborah Glynn, Sheffield 6629, Tokyo - 6432, Portugal",10/2/2007,936,Pending
937,"Mr. Denis Rycroft, Champion  7532, Hollywood - 3612, Cameroon",1/15/2020,937,Pending
938,"Miss Moira Truscott, Caxton  320, Rome - 7172, Mali",5/6/2011,938,Pending
939,"Mr. Doug Taylor, Cheltenham  7339, Murfreesboro - 0362, Malawi",4/14/2008,939,Pending
940,"Mr. Fred Cork, Bishop   8062, Moreno Valley - 2202, Thailand",11/17/2009,940,Pending
941,"Miss Martha Broomfield, Berriman  1220, Colorado Springs - 2186, Guyana",11/9/2014,941,Pending
942,"Mr. Daniel Long, Collent   2468, Garland - 3368, Pakistan",7/25/2010,942,Pending
943,"Mr. Josh Griffiths, Queen 8817, Tallahassee - 7244, Bosnia and Herzegovina",3/31/2001,943,Pending
944,"Mrs. Rosa Mason, Waite  3723, Saint Paul - 8514, Liberia",10/4/2003,944,Pending
945,"Mr. Denny Hunter, Hammersmith  9486, San Bernardino - 1501, Montenegro",1/31/2015,945,Pending
946,"Ms. Jules Wade, Bermondsey    422, Fort Lauderdale - 4387, Mexico",4/15/2008,946,Pending
947,"Mr. Mike Jeffery, Chamberlain  8086, Jersey City - 5558, Iceland",4/8/2005,947,Pending
948,"Mr. Javier Mcguire, Buttonwood 7102, Jacksonville - 2272, Dominica",1/23/2002,948,Pending
949,"Mr. Clint Davies, Rivervalley 6498, Otawa - 3703, Saint Vincent and the Grenadines",3/18/2001,949,Pending
950,"Mr. Denis Gunn, Betton  6165, Richmond - 0143, United Kingdom",8/30/2010,950,Pending
951,"Mr. Abdul Owen, Rail 4632, Milwaukee - 2861, Dominica",7/31/2006,951,Pending
952,"Mr. Cedrick Stevens, Geffrye   421, Bucharest - 6044, Paraguay",8/5/2006,952,Pending
953,"Miss Jaylene Neville, Chartham  2558, Arlington - 2357, Lithuania",10/31/2008,953,Pending
954,"Ms. Winnie Cattell, Spruce 8635, Albuquerque - 7208, Lesotho",3/8/2019,954,Pending
955,"Miss Maddison Tate, Beaumont  4313, Lincoln - 2852, Brunei",7/5/2004,955,Pending
956,"Miss Mary Marshall, Bingham   6081, New Orleans - 6644, Colombia",3/13/2007,956,Pending
957,"Ms. Rita Whitehouse, Monroe 2952, Arlington - 7833, Bosnia and Herzegovina",8/21/2011,957,Pending
958,"Mrs. Jazmin Emmett, Victoria Rise 6463, Philadelphia - 2336, Czech Republic",2/11/2019,958,Pending
959,"Ms. Eileen Kelly, Littlebury  8419, Henderson - 4672, Romania",7/3/2005,959,Pending
960,"Mr. George Nielson, Argyle  4147, Houston - 0370, El Salvador",6/21/2011,960,Pending
961,"Mrs. Juliet Mccormick, Hammersmith  6399, Washington - 7202, Zambia",10/5/2007,961,Pending
962,"Mrs. Harriet Lakey, Boldero   9958, Columbus - 7284, Macedonia",8/22/2015,962,Pending
963,"Ms. Piper Dallas, Hickory   6087, New Orleans - 2866, Suriname",7/29/2003,963,Pending
964,"Ms. Hanna Foxley, Sundown 2924, Charlotte - 3601, France",11/7/2002,964,Pending
965,"Ms. Candace Walsh, Virginia 673, London - 6046, Turkey",10/23/2004,965,Pending
966,"Mrs. Macy Irving, Argyle  100, Oklahoma City - 4141, Madagascar",3/10/2008,966,Pending
967,"Mrs. Laila Ross, Waite  4013, Boston - 7607, Australia",7/7/2012,967,Pending
968,"Miss Chelsea Gordon, Battersea   4762, Reno - 1420, Saint Vincent and the Grenadines",9/14/2018,968,Pending
969,"Ms. Celia Price, Antrobus   5352, Wien - 7337, Tuvalu",11/8/2003,969,Pending
970,"Miss Jocelyn Gordon, Chester  6924, Saint Paul - 1805, Ukraine",3/24/2006,970,Pending
971,"Mrs. Candice Olson, Norland  5833, Madrid - 7850, Zambia",12/10/2012,971,Pending
972,"Ms. Gladys Gilbert, Dunton  8915, Jacksonville - 5365, Sri Lanka",6/16/2019,972,Pending
973,"Miss Cadence Cooper, Anns  3723, Long Beach - 6234, Cambodia",2/19/2013,973,Pending
974,"Mrs. Cassidy Grady, Balfe   7203, Minneapolis - 7721, Barbados",5/31/2019,974,Pending
975,"Miss Zara Rose, Bedford  3651, Detroit - 8807, Albania",3/25/2008,975,Pending
976,"Ms. Lindsay Cameron, Erindale 5549, Stockton - 6576, Macedonia",5/9/2004,976,Pending
977,"Miss Felicity Wilson, Under  8305, Fullerton - 6440, Australia",7/14/2017,977,Pending
978,"Mrs. Allison Vollans, Colombo   3330, Lincoln - 4541, Belarus",11/19/2012,978,Pending
979,"Miss Cynthia Parker, Coborn  350, Berlin - 3010, Guatemala",5/1/2011,979,Pending
980,"Miss Hanna Price, Yorkshire  9582, Oklahoma City - 1633, Turkmenistan",9/17/2014,980,Pending
981,"Miss Rosalee Mann, Norland  7931, El Paso - 2607, Congo",8/28/2006,981,Pending
982,"Miss Joyce Casey, King 1916, Paris - 2348, Sudan, South",2/19/2014,982,Pending
983,"Ms. Eryn Jones, Chester      9914, Las Vegas - 6837, Egypt",10/10/2003,983,Pending
984,"Miss Shannon Cooper, Monroe 3253, Phoenix - 5464, Lithuania",6/24/2018,984,Pending
985,"Miss Vanessa Cox, Castile  643, Houston - 5657, Bolivia",10/11/2006,985,Pending
986,"Ms. Sasha Grady, East 6872, Quebec - 6573, Antigua and Barbuda",7/23/2010,986,Pending
987,"Miss Anne Wigley, Chatsworth  8102, Arlington - 3872, Mauritius",6/9/2009,987,Pending
988,"Ms. Noemi Rehman, Cingworth  6505, Lancaster - 6744, Uzbekistan",3/25/2014,988,Pending
989,"Ms. Emma Gray, Fairview 7755, Laredo - 7780, New Zealand",6/3/2008,989,Pending
990,"Miss Martha Bennett, Bendall   111, San Antonio - 0303, Comoros",1/28/2007,990,Pending
991,"Mrs. Francesca Flett, King 8710, Milwaukee - 8148, Sri Lanka",3/21/2012,991,Pending
992,"Miss Kenzie Harrison, Egerton  9179, Lincoln - 7270, Germany",6/14/2007,992,Pending
993,"Miss Cynthia Booth, Calshot   9515, Oklahoma City - 6850, Botswana",10/22/2001,993,Pending
994,"Ms. Harmony Darcy, Chalcot  9859, Salem - 7458, Nigeria",7/6/2017,994,Pending
995,"Mrs. Sienna Hooper, Blake  4474, San Antonio - 2346, Solomon Islands",9/16/2017,995,Pending
996,"Miss Naomi Allington, Arbutus   312, Charlotte - 2472, Malaysia",3/2/2020,996,Pending
997,"Mrs. Britney Ebbs, Lake 6778, Sacramento - 2480, Indonesia",2/12/2005,997,Pending
998,"Mrs. Carolyn Adams, Egerton  4570, Tokyo - 0652, Lebanon",9/16/2002,998,Pending
999,"Mrs. Makena Farrant, Becklow  2853, Worcester - 5125, Tonga",1/18/2020,999,Pending
1000,"Miss Melania Blackwall, Tilloch   8993, Bellevue - 5516, Serbia",5/20/2007,1000,Pending
